{
  "$schema": "http://json-schema.org/draft-07/schema#",
  "$id": "evidence-trial-observation.schema.json",
  "title": "EvidenceTrialObservation 1.0",
  "type": "object",
  "additionalProperties": false,
  "required": ["schema_version", "observation_id", "trial_id", "observed_at", "evidence_bundle", "runtime_outcome", "runtime_reason_code", "human_intervention_required", "decision_latency_ms", "provenance"],
  "properties": {
    "schema_version": {"const": "1.0"},
    "observation_id": {"$ref": "#/definitions/id"},
    "trial_id": {"$ref": "#/definitions/id"},
    "observed_at": {"$ref": "#/definitions/timestamp"},
    "evidence_bundle": {"$ref": "evidence-bundle.schema.json"},
    "runtime_outcome": {"enum": ["not_attempted", "delivered", "deny"]},
    "runtime_reason_code": {"type": ["string", "null"], "pattern": "^[a-z0-9_]+$"},
    "human_intervention_required": {"type": "boolean"},
    "decision_latency_ms": {"type": "integer", "minimum": 0},
    "provenance": {"type": "object", "additionalProperties": false, "required": ["collector_version", "kind"], "properties": {"collector_version": {"const": "1.0"}, "kind": {"const": "local_trial_observation"}}}
  },
  "allOf": [{"if": {"properties": {"runtime_outcome": {"const": "not_attempted"}}}, "then": {"properties": {"runtime_reason_code": {"type": "null"}}}, "else": {"properties": {"runtime_reason_code": {"type": "string"}}}}],
  "definitions": {
    "id": {"type": "string", "pattern": "^[A-Za-z0-9][A-Za-z0-9_.-]{0,127}(?![\\s\\S])"},
    "timestamp": {"type": "string", "pattern": "^\\d{4}-\\d{2}-\\d{2}T\\d{2}:\\d{2}:\\d{2}Z(?![\\s\\S])"}
  }
}
