{"schema_version":"1.0","observation_id":"observation-1","trial_id":"trial-1","observed_at":"2026-09-22T12:00:00Z","evidence_bundle":{"schema_version":"1.0","bundle_id":"e80dda0905eaf7033dc94a5191a7727cb33e2ed8f888977343f1d4f48e7e0390","run_id":"run-h4-01","adapter_id":"local-adapter","created_at":"2026-09-22T12:00:00Z","decision_id":"0000000000000000000000000000000000000000000000000000000000000000","decision_outcome":"deny","reason_code":"invalid_intent","profile_sha256":"0000000000000000000000000000000000000000000000000000000000000000","policy_sha256":"0000000000000000000000000000000000000000000000000000000000000000","intent_digest":null,"operation_id":"read","effective_scope":{"kind":"filesystem","path":"docs/readme.md"},"workspace_id":"workspace","snapshot_digest":"0000000000000000000000000000000000000000000000000000000000000000","read_result_digest":null,"read_result_classification":null,"receipt":null,"verification":{"verification_version":"1.0","canonicalization":"json-c14n-v1","bundle_sha256":"972663807b6b0ade123f2c3d00e9c798b366da332278433c0e54f4318be609bf"},"provenance":{"adapter_version":"1.0","pdp_version":"1.0","pep_version":"not_called","kind":"local_evidence_composition"}},"runtime_outcome":"not_attempted","runtime_reason_code":null,"human_intervention_required":false,"decision_latency_ms":0,"provenance":{"collector_version":"1.0","kind":"local_trial_observation"}}
